[
  {
    "reviewer": "feasibility",
    "findings": [
      {
        "id": "E1",
        "title": "Comma splitting invalidates quoted-cell verification",
        "section": "U2",
        "why_it_matters": "The U2 method splits the quoted cell \"a,b\" into two cells and cannot verify the required round trip.",
        "finding_type": "error",
        "autofix_class": "gated_auto",
        "suggested_fix": "Replace comma splitting with a CSV-aware round-trip check or exact expected CSV strings for the required fixtures.",
        "confidence": 100,
        "severity": "P1",
        "evidence": [
          "U2 verifies round-trip preservation by splitting each serialized line on commas and comparing the parts with the input cells."
        ]
      },
      {
        "id": "E2",
        "title": "Select retention to make cleanup implementable",
        "section": "U3",
        "why_it_matters": "U3 needs a retention constant before implementation can finish.",
        "finding_type": "error",
        "autofix_class": "gated_auto",
        "suggested_fix": "Set retention to 7 days in the Product Contract and U3.",
        "confidence": 100,
        "severity": "P1",
        "evidence": [
          "U3 implements the cleanup job after the retention choice is settled."
        ]
      },
      {
        "id": "E3",
        "title": "Repeat the quoting rule in U1",
        "section": "U1",
        "why_it_matters": "An implementer reading only U1 might not see the quoting definition.",
        "finding_type": "error",
        "autofix_class": "gated_auto",
        "suggested_fix": "Copy the complete quoting rule into U1.",
        "confidence": 100,
        "severity": "P1",
        "evidence": [
          "U1 implements CSV with the Planning Contract's quoting rules and tests ordinary and quoted values."
        ]
      }
    ],
    "residual_risks": [],
    "deferred_questions": []
  }
]
